{
  "$schemaVersion": 1,
  "case": "redirects-backslash-meta",
  "description": "Codex round 9 P1: empirical probe of minimatch 3.1.5's `\\X` handling. Reference behavior: `\\X` is transparent — the backslash is effectively stripped and the meta-character keeps its glob meaning for X in `*`/`?`/`[`/`{`. The `\\.` case (round 8) admits leading-dot paths because the de-escaped form starts with a literal `.`; the same de-escape uniformly applies to all glob meta characters but they retain their meta meaning when they're, well, meta. Locks the round-9 fix that reverted the round-8 over-generalization (`backslash_escape(true)` on globset which made `\\*` literal-`*`).",
  "fixture": {
    "files": {
      "_marker.txt": "marker\n"
    },
    "serveJson": {
      "redirects": [
        {
          "source": "/s/\\*",
          "destination": "/star-hit"
        },
        {
          "source": "/q/\\?",
          "destination": "/qmark-hit"
        },
        {
          "source": "/br/\\[ab]",
          "destination": "/bracket-hit"
        },
        {
          "source": "/bc/\\{a,b}",
          "destination": "/brace-hit"
        }
      ]
    }
  },
  "serveArgs": [],
  "volatileHeaders": [
    "last-modified"
  ],
  "volatileBodies": [],
  "requests": [
    {
      "name": "escaped_star_keeps_glob",
      "request": {
        "method": "GET",
        "mode": "fetch",
        "path": "/s/foo"
      },
      "response": {
        "body": {
          "kind": "empty",
          "length": 0,
          "sha256": "e3b0c44298fc1c149afbf4c8996fb92427ae41e4649b934ca495991b7852b855"
        },
        "headers": {
          "location": "/star-hit"
        },
        "status": 301,
        "statusText": "Moved Permanently"
      }
    },
    {
      "name": "escaped_question_keeps_glob",
      "request": {
        "method": "GET",
        "mode": "fetch",
        "path": "/q/a"
      },
      "response": {
        "body": {
          "kind": "empty",
          "length": 0,
          "sha256": "e3b0c44298fc1c149afbf4c8996fb92427ae41e4649b934ca495991b7852b855"
        },
        "headers": {
          "location": "/qmark-hit"
        },
        "status": 301,
        "statusText": "Moved Permanently"
      }
    },
    {
      "name": "escaped_bracket_keeps_glob_a",
      "request": {
        "method": "GET",
        "mode": "fetch",
        "path": "/br/a"
      },
      "response": {
        "body": {
          "kind": "empty",
          "length": 0,
          "sha256": "e3b0c44298fc1c149afbf4c8996fb92427ae41e4649b934ca495991b7852b855"
        },
        "headers": {
          "location": "/bracket-hit"
        },
        "status": 301,
        "statusText": "Moved Permanently"
      }
    },
    {
      "name": "escaped_bracket_keeps_glob_b",
      "request": {
        "method": "GET",
        "mode": "fetch",
        "path": "/br/b"
      },
      "response": {
        "body": {
          "kind": "empty",
          "length": 0,
          "sha256": "e3b0c44298fc1c149afbf4c8996fb92427ae41e4649b934ca495991b7852b855"
        },
        "headers": {
          "location": "/bracket-hit"
        },
        "status": 301,
        "statusText": "Moved Permanently"
      }
    },
    {
      "name": "escaped_brace_keeps_glob_a",
      "request": {
        "method": "GET",
        "mode": "fetch",
        "path": "/bc/a"
      },
      "response": {
        "body": {
          "kind": "empty",
          "length": 0,
          "sha256": "e3b0c44298fc1c149afbf4c8996fb92427ae41e4649b934ca495991b7852b855"
        },
        "headers": {
          "location": "/brace-hit"
        },
        "status": 301,
        "statusText": "Moved Permanently"
      }
    }
  ]
}
