{
  "$schemaVersion": 1,
  "case": "headers-applied",
  "description": "Custom headers actually applied to a fetched (non-redirected) file. Uses .css to avoid cleanUrls redirect on .html.",
  "fixture": {
    "files": {
      "asset.css": "body{}\n"
    },
    "serveJson": {
      "headers": [
        {
          "source": "**/*.css",
          "headers": [
            {
              "key": "Cache-Control",
              "value": "public, max-age=600"
            },
            {
              "key": "X-Custom",
              "value": "yes"
            }
          ]
        }
      ]
    }
  },
  "serveArgs": [],
  "volatileHeaders": [
    "last-modified"
  ],
  "volatileBodies": [],
  "requests": [
    {
      "name": "css_get",
      "request": {
        "method": "GET",
        "mode": "fetch",
        "path": "/asset.css"
      },
      "response": {
        "body": {
          "kind": "text",
          "length": 7,
          "sha256": "2708d73bf31c36cdfa1aa466551ed101017280fa546caba4473cfef6e92a93b5",
          "preview": "body{}\n"
        },
        "headers": {
          "accept-ranges": "bytes",
          "cache-control": "public, max-age=600",
          "content-length": "7",
          "content-type": "text/css; charset=utf-8",
          "etag": "\"3daef43df4ef7acd6f554df47081815e1e7eb8ff\"",
          "vary": "Accept-Encoding",
          "x-custom": "yes"
        },
        "status": 200,
        "statusText": "OK"
      }
    }
  ]
}
