{
  "$schemaVersion": 1,
  "case": "config-explicit-public",
  "description": "`--config alt.json` overrides the default `serve.json` lookup. The fixture ships both: `serve.json` sets `public: default-dir` (with `default-dir/index.html` saying `default`); `alt.json` sets `public: site` (with `site/index.html` saying `site`). With `--config alt.json`, the alternate file wins and `GET /` serves the `site` content. Backs SRV-CLI-009 and SRV-CFG-001 (explicit-overrides-default scenario, observable through `public`).",
  "fixture": {
    "files": {
      "default-dir/index.html": "<p>default</p>\n",
      "site/index.html": "<p>site</p>\n",
      "alt.json": "{\n  \"public\": \"site\"\n}\n"
    },
    "serveJson": {
      "public": "default-dir"
    }
  },
  "serveArgs": [
    "--config",
    "alt.json"
  ],
  "volatileHeaders": [
    "last-modified"
  ],
  "volatileBodies": [],
  "requests": [
    {
      "name": "alt_config_public_redirects_root",
      "request": {
        "method": "GET",
        "mode": "fetch",
        "path": "/"
      },
      "response": {
        "body": {
          "kind": "text",
          "length": 12,
          "sha256": "c74a40ed1a2875fc72cc45227b72b92367fd2c4fac091b1ef6afad88439f5a64",
          "preview": "<p>site</p>\n"
        },
        "headers": {
          "accept-ranges": "bytes",
          "content-length": "12",
          "content-type": "text/html; charset=utf-8",
          "etag": "\"866ce31146f9fe1783840e32164ad58f515ec684\"",
          "vary": "Accept-Encoding"
        },
        "status": 200,
        "statusText": "OK"
      }
    }
  ]
}
