{
  "$schemaVersion": 1,
  "case": "trailingslash-strip",
  "description": "`serve.json: {\"trailingSlash\": false, \"cleanUrls\": false}` → paths ending in `/` get a 301 to the stripped form. `cleanUrls` is explicitly disabled so the cleanUrls 301 (Stage 6c) cannot mask or compose with the trailingSlash redirect. The anti-redirect anchor uses `/about.html` (no trailing slash, file with extension served directly) to verify phase 5 does not fire when it should not. The double-slash anchor verifies the multi-slash override (`serve-handler/src/index.js:158-160`): when trailingSlash is set and the path contains `//`, the redirect target is the slash-collapsed form (NOT the strip-target) — confirms `/test//` → `/test/`, not `/test`. Backs SRV-ROUT-004 and SRV-ROUT-005.",
  "fixture": {
    "files": {
      "about.html": "<p>about</p>\n",
      "index.html": "<p>home</p>\n"
    },
    "serveJson": {
      "trailingSlash": false,
      "cleanUrls": false
    }
  },
  "serveArgs": [],
  "volatileHeaders": [
    "last-modified"
  ],
  "volatileBodies": [],
  "requests": [
    {
      "name": "about_with_slash_redirects",
      "request": {
        "method": "GET",
        "mode": "fetch",
        "path": "/about/"
      },
      "response": {
        "body": {
          "kind": "empty",
          "length": 0,
          "sha256": "e3b0c44298fc1c149afbf4c8996fb92427ae41e4649b934ca495991b7852b855"
        },
        "headers": {
          "location": "/about"
        },
        "status": 301,
        "statusText": "Moved Permanently"
      }
    },
    {
      "name": "about_no_slash_no_redirect",
      "request": {
        "method": "GET",
        "mode": "fetch",
        "path": "/about.html"
      },
      "response": {
        "body": {
          "kind": "text",
          "length": 13,
          "sha256": "473bca61a87e3877fe6d15ba53a4995e552554aa0b167240f61ce82c746f4c13",
          "preview": "<p>about</p>\n"
        },
        "headers": {
          "accept-ranges": "bytes",
          "content-length": "13",
          "content-type": "text/html; charset=utf-8",
          "etag": "\"de1863a8c5dccbd2368ff93c276304e91cdcc9f1\"",
          "vary": "Accept-Encoding"
        },
        "status": 200,
        "statusText": "OK"
      }
    },
    {
      "name": "trailing_double_slash_collapses_via_redirect",
      "request": {
        "method": "GET",
        "mode": "fetch",
        "path": "/about//"
      },
      "response": {
        "body": {
          "kind": "empty",
          "length": 0,
          "sha256": "e3b0c44298fc1c149afbf4c8996fb92427ae41e4649b934ca495991b7852b855"
        },
        "headers": {
          "location": "/about/"
        },
        "status": 301,
        "statusText": "Moved Permanently"
      }
    }
  ]
}
