{
  "$schemaVersion": 1,
  "case": "redirects-edge-corners",
  "description": "Codex round 10 corners: (P1.1) `\\**` parses as globstar in minimatch (de-escape before `**` check); (P1.2) per-alt dot rule for braces — `{.x,*}` admits `.x` via dot alt and `abc` via `*` alt but REJECTS `.y` because the `*` alt obeys `dot: false`; (P2) `\\[` falls back to a Literal match against `[` (the de-escaped pattern is invalid globset, so the classifier degrades gracefully).",
  "fixture": {
    "files": {
      "_marker.txt": "marker\n"
    },
    "serveJson": {
      "redirects": [
        {
          "source": "/a/\\**",
          "destination": "/escaped-doublestar-hit"
        },
        {
          "source": "/x/{.x,*}",
          "destination": "/brace-mix-hit"
        },
        {
          "source": "/u/\\[",
          "destination": "/lbracket-hit"
        }
      ]
    }
  },
  "serveArgs": [],
  "volatileHeaders": [
    "last-modified"
  ],
  "volatileBodies": [],
  "requests": [
    {
      "name": "escaped_doublestar_matches_multi",
      "request": {
        "method": "GET",
        "mode": "fetch",
        "path": "/a/x/y"
      },
      "response": {
        "body": {
          "kind": "empty",
          "length": 0,
          "sha256": "e3b0c44298fc1c149afbf4c8996fb92427ae41e4649b934ca495991b7852b855"
        },
        "headers": {
          "location": "/escaped-doublestar-hit"
        },
        "status": 301,
        "statusText": "Moved Permanently"
      }
    },
    {
      "name": "brace_mix_matches_dot_alt",
      "request": {
        "method": "GET",
        "mode": "fetch",
        "path": "/x/.x"
      },
      "response": {
        "body": {
          "kind": "empty",
          "length": 0,
          "sha256": "e3b0c44298fc1c149afbf4c8996fb92427ae41e4649b934ca495991b7852b855"
        },
        "headers": {
          "location": "/brace-mix-hit"
        },
        "status": 301,
        "statusText": "Moved Permanently"
      }
    },
    {
      "name": "brace_mix_matches_star_alt",
      "request": {
        "method": "GET",
        "mode": "fetch",
        "path": "/x/abc"
      },
      "response": {
        "body": {
          "kind": "empty",
          "length": 0,
          "sha256": "e3b0c44298fc1c149afbf4c8996fb92427ae41e4649b934ca495991b7852b855"
        },
        "headers": {
          "location": "/brace-mix-hit"
        },
        "status": 301,
        "statusText": "Moved Permanently"
      }
    },
    {
      "name": "brace_mix_rejects_other_dotfile",
      "request": {
        "method": "GET",
        "mode": "fetch",
        "path": "/x/.y"
      },
      "response": {
        "body": {
          "kind": "text",
          "length": 1641,
          "sha256": "8c45c679f40c3f81c111fbf2398d568189c3ab34d8a9704ad225cd8efe1b819f",
          "preview": "<!DOCTYPE html><head> <meta name=\"viewport\" content=\"width=device-width, initial-scale=1, user-scalable=no\"/> <style> body { margin: 0; font-family: -apple-system, BlinkMacSystemFont, \"Segoe UI\", \"Rob"
        },
        "headers": {
          "content-type": "text/html; charset=utf-8",
          "vary": "Accept-Encoding"
        },
        "status": 404,
        "statusText": "Not Found"
      }
    },
    {
      "name": "literal_lbracket_via_fallback",
      "request": {
        "method": "GET",
        "mode": "fetch",
        "path": "/u/["
      },
      "response": {
        "body": {
          "kind": "empty",
          "length": 0,
          "sha256": "e3b0c44298fc1c149afbf4c8996fb92427ae41e4649b934ca495991b7852b855"
        },
        "headers": {
          "location": "/lbracket-hit"
        },
        "status": 301,
        "statusText": "Moved Permanently"
      }
    }
  ]
}
