{
  "$schemaVersion": 1,
  "case": "cors-response-surface",
  "description": "Enumerate the CORS response-header surface under --cors across response types: 200 file, 301 cleanUrls redirect, 404 missing path. Backs SRV-CORS-001.",
  "fixture": {
    "files": {
      "index.html": "<!doctype html><title>home</title>\n",
      "asset.css": "body{}\n"
    }
  },
  "serveArgs": [
    "--cors"
  ],
  "volatileHeaders": [
    "last-modified"
  ],
  "volatileBodies": [],
  "requests": [
    {
      "name": "file_200",
      "request": {
        "method": "GET",
        "mode": "fetch",
        "path": "/asset.css"
      },
      "response": {
        "body": {
          "kind": "text",
          "length": 7,
          "sha256": "2708d73bf31c36cdfa1aa466551ed101017280fa546caba4473cfef6e92a93b5",
          "preview": "body{}\n"
        },
        "headers": {
          "accept-ranges": "bytes",
          "access-control-allow-credentials": "true",
          "access-control-allow-headers": "*",
          "access-control-allow-origin": "*",
          "access-control-allow-private-network": "true",
          "content-length": "7",
          "content-type": "text/css; charset=utf-8",
          "etag": "\"3daef43df4ef7acd6f554df47081815e1e7eb8ff\"",
          "vary": "Accept-Encoding"
        },
        "status": 200,
        "statusText": "OK"
      }
    },
    {
      "name": "cleanurls_301",
      "request": {
        "method": "GET",
        "mode": "fetch",
        "path": "/index.html"
      },
      "response": {
        "body": {
          "kind": "empty",
          "length": 0,
          "sha256": "e3b0c44298fc1c149afbf4c8996fb92427ae41e4649b934ca495991b7852b855"
        },
        "headers": {
          "access-control-allow-credentials": "true",
          "access-control-allow-headers": "*",
          "access-control-allow-origin": "*",
          "access-control-allow-private-network": "true",
          "location": "/index"
        },
        "status": 301,
        "statusText": "Moved Permanently"
      }
    },
    {
      "name": "missing_404",
      "request": {
        "method": "GET",
        "mode": "fetch",
        "path": "/nope"
      },
      "response": {
        "body": {
          "kind": "text",
          "length": 1641,
          "sha256": "8c45c679f40c3f81c111fbf2398d568189c3ab34d8a9704ad225cd8efe1b819f",
          "preview": "<!DOCTYPE html><head> <meta name=\"viewport\" content=\"width=device-width, initial-scale=1, user-scalable=no\"/> <style> body { margin: 0; font-family: -apple-system, BlinkMacSystemFont, \"Segoe UI\", \"Rob"
        },
        "headers": {
          "access-control-allow-credentials": "true",
          "access-control-allow-headers": "*",
          "access-control-allow-origin": "*",
          "access-control-allow-private-network": "true",
          "content-type": "text/html; charset=utf-8",
          "vary": "Accept-Encoding"
        },
        "status": 404,
        "statusText": "Not Found"
      }
    }
  ]
}
